Name,Owner,Desc,url,forks,stars,commits,watches,created_at,pushed_at
resource,giantswarm,,https://github.com/giantswarm/resource,1,0,14,136,2019-09-11,2023-03-15
druid-operator,druid-io,Druid Kubernetes Operator,https://github.com/druid-io/druid-operator,94,189,14,181,2019-10-30,2023-03-06
splunk-operator,splunk,Splunk Operator for Kubernetes,https://github.com/splunk/splunk-operator,87,165,41,1557,2019-10-10,2023-03-19
datadog-operator,DataDog,Datadog Agent Kubernetes Operator,https://github.com/DataDog/datadog-operator,70,184,137,630,2019-11-19,2023-03-16
cockroach-operator,cockroachdb,k8s operator for CRDB,https://github.com/cockroachdb/cockroach-operator,76,217,47,589,2019-11-20,2023-03-18
chaosblade-operator,chaosblade-io,chaosblade operator for kubernetes experiments,https://github.com/chaosblade-io/chaosblade-operator,76,138,19,126,2019-11-03,2023-01-06
fdb-kubernetes-operator,FoundationDB,A kubernetes operator for FoundationDB,https://github.com/FoundationDB/fdb-kubernetes-operator,65,164,22,1672,2019-11-15,2023-03-21
baremetal-deploy,openshift-kni,Deployment artifacts for OpenShift KNI bare metal clusters,https://github.com/openshift-kni/baremetal-deploy,133,114,18,680,2019-11-21,2023-03-21
helm-charts,VictoriaMetrics,Helm charts for VictoriaMetrics,https://github.com/VictoriaMetrics/helm-charts,230,194,12,727,2019-10-10,2023-03-17
amazon-sagemaker-operator-for-k8s,aws,Amazon SageMaker operator for Kubernetes,https://github.com/aws/amazon-sagemaker-operator-for-k8s,50,146,10,164,2019-11-15,2023-02-25
submariner-operator,submariner-io,Submariner's Operator installs and maintains your Submariner deployment.,https://github.com/submariner-io/submariner-operator,64,74,13,1712,2019-10-04,2023-03-21
kuttl,kudobuilder,KUbernetes Test TooL (kuttl),https://github.com/kudobuilder/kuttl,62,440,18,224,2019-11-23,2023-03-11
inlets-pro,inlets,Secure HTTP and TCP tunnels that just work,https://github.com/inlets/inlets-pro,43,468,13,148,2019-10-12,2023-03-17
quay,quay,"Build, Store, and Distribute your Applications and Containers",https://github.com/quay/quay,242,2142,35,11135,2019-11-08,2023-03-20
deckhouse,deckhouse,Kubernetes platform from Flant,https://github.com/deckhouse/deckhouse,75,809,19,9844,2019-10-17,2023-03-20
bevel,hyperledger,An automation framework for rapidly and consistently deploying production-ready DLT platforms,https://github.com/hyperledger/bevel,576,295,28,3750,2019-10-16,2023-03-21
jiva-operator,openebs,Kubernetes Operator for managing Jiva Volumes via custom resource.,https://github.com/openebs/jiva-operator,42,36,15,148,2019-10-23,2023-03-10
telegraf-operator,influxdata,telegraf-operator helps monitor application on Kubernetes with Telegraf,https://github.com/influxdata/telegraf-operator,36,73,20,73,2019-11-29,2023-03-07
container-security-operator,quay,Identify image vulnerabilities in Kubernetes pods,https://github.com/quay/container-security-operator,29,89,10,119,2019-10-28,2022-12-07
cloudflow,lightbend,"Cloudflow enables users to quickly develop, orchestrate, and operate distributed streaming applications on Kubernetes.",https://github.com/lightbend/cloudflow,93,322,16,1195,2019-11-08,2023-03-18
okd,okd-project,"The self-managing, auto-upgrading, Kubernetes distribution for everyone",https://github.com/okd-project/okd,272,1427,99,164,2019-11-15,2023-03-18
hostpath-provisioner-operator,kubevirt,,https://github.com/kubevirt/hostpath-provisioner-operator,27,25,12,316,2019-10-25,2023-03-14
k8gb,k8gb-io,A cloud native Kubernetes Global Balancer,https://github.com/k8gb-io/k8gb,66,552,16,850,2019-11-27,2023-03-21
community,operator-framework,Community organizational documentations and process for Operator Framework,https://github.com/operator-framework/community,23,25,11,130,2019-10-11,2023-02-27
k8s-wso2am-operator,wso2,WSO2 API Manager Operator for Kubernetes,https://github.com/wso2/k8s-wso2am-operator,16,20,112,541,2019-10-22,2023-03-07
agent,grafana,Telemetry agent for the LGTM stack.,https://github.com/grafana/agent,292,1004,115,1504,2019-11-25,2023-03-20
awesome-devops,wmariuss,"A curated list of awesome DevOps platforms, tools, practices and resources",https://github.com/wmariuss/awesome-devops,153,888,30,151,2019-11-19,2023-03-20
gcp-project-operator,openshift,Operator responsible for managing GCP projects and credentials.,https://github.com/openshift/gcp-project-operator,46,29,45,386,2019-10-18,2023-03-07
splunk-forwarder-operator,openshift,,https://github.com/openshift/splunk-forwarder-operator,40,14,42,366,2019-10-16,2023-03-16
devspaces-chectl,redhat-developer,"CodeReady Workspaces build of chectl, based on https://github.com/che-incubator/chectl/",https://github.com/redhat-developer/devspaces-chectl,16,17,18,2500,2019-10-28,2023-03-20
contrail-operator,Juniper,Juniper K8s contrail operator,https://github.com/Juniper/contrail-operator,9,18,124,836,2019-11-06,2022-12-30
azure-service-operator-samples,Azure-Samples,Sample applications and manifests to demonstrate the use of the Azure Service Operator,https://github.com/Azure-Samples/azure-service-operator-samples,14,7,18,70,2019-10-03,2023-03-07
vcenter-event-broker-appliance,vmware-samples,The VMware Event Broker Appliance Fling enables customers to unlock the hidden potential of events in their SDDC to easily create event-driven automation.,https://github.com/vmware-samples/vcenter-event-broker-appliance,63,131,18,1133,2019-11-13,2023-03-19
inletsctl,inlets,Create inlets servers on the top cloud platforms,https://github.com/inlets/inletsctl,59,429,10,199,2019-10-29,2023-02-18
wavefront-operator-for-kubernetes,wavefrontHQ,Lifecycle management of Wavefront assets in Kubernetes,https://github.com/wavefrontHQ/wavefront-operator-for-kubernetes,12,4,20,377,2019-10-23,2023-03-20
kustomize-sops,viaduct-ai,KSOPS - A Flexible Kustomize Plugin for SOPS Encrypted Resources,https://github.com/viaduct-ai/kustomize-sops,52,458,15,200,2019-10-24,2023-02-18
k-rail,cruise-automation,Kubernetes security tool for policy enforcement,https://github.com/cruise-automation/k-rail,60,446,14,189,2019-10-03,2023-01-12
cluster-resource-override-admission-operator,openshift,Operator for the mutating admission webhook for ClusterResourceOverride,https://github.com/openshift/cluster-resource-override-admission-operator,26,6,12,173,2019-10-24,2023-03-14
terraform-google-jx,jenkins-x,A Terraform module for creating Jenkins X infrastructure on Google Cloud,https://github.com/jenkins-x/terraform-google-jx,79,37,20,261,2019-11-27,2023-01-11
concourse-chart,concourse,Helm chart to install Concourse,https://github.com/concourse/concourse-chart,165,122,13,1009,2019-10-02,2023-02-20
shipshape,rh-messaging,"Openshift Operator test framework, written in go",https://github.com/rh-messaging/shipshape,8,6,32,136,2019-11-12,2023-03-14
extendeddaemonset,DataDog,Kubernetes Extended Daemonset controller,https://github.com/DataDog/extendeddaemonset,11,79,11,172,2019-11-19,2023-03-07
esp-kubernetes,sassoftware,This repository provides a set of deployment scripts and utilities to enable easy deployment of SAS ESP to a kubernetes cluster..,https://github.com/sassoftware/esp-kubernetes,7,10,13,354,2019-11-15,2023-02-24
tag-network,cncf,🌐 CNCF Network TAG,https://github.com/cncf/tag-network,13,53,23,74,2019-10-02,2023-01-12
private-data-collections-on-fabric,IBM,This repo demonstrates the use of collections to provide storage and retrieval of private data on the blockchain network for authorized peers of organizations. It shows how to use private data on the IBM Blockchain Platform.,https://github.com/IBM/private-data-collections-on-fabric,18,19,10,72,2019-11-26,2023-01-01
utask,ovh,µTask is an automation engine that models and executes business processes declared in yaml. ✏️📋,https://github.com/ovh/utask,65,844,36,363,2019-11-05,2023-03-18
eks-appmesh-profile,weaveworks,AWS App Mesh eksctl profile,https://github.com/weaveworks/eks-appmesh-profile,9,10,51,37,2019-10-03,2022-10-13
managed-cluster-validating-webhooks,openshift,"Set of validating webhooks, based on k8s admission controllers, for OSD clusters",https://github.com/openshift/managed-cluster-validating-webhooks,55,7,47,452,2019-10-11,2023-02-21
go-awesome,shockerli,Go 语言优秀资源整理，为项目落地加速🏃,https://github.com/shockerli/go-awesome,468,3233,76,92,2019-10-29,2023-03-20
jet-train,hazelcast,,https://github.com/hazelcast/jet-train,4,14,43,177,2019-10-12,2023-03-13
chart,codacy,Codacy Helm chart and self-hosted infrastructure quickstart,https://github.com/codacy/chart,8,11,16,1334,2019-10-30,2023-03-20
monocle,change-metrics,Monocle helps teams and individual to better organize daily duties and to detect anomalies in the way changes are produced and reviewed.,https://github.com/change-metrics/monocle,42,263,10,3085,2019-11-29,2023-02-14
agnosticv,redhat-cop,Organize and merge YAML files to manage a Catalog,https://github.com/redhat-cop/agnosticv,4,6,10,41,2019-11-13,2023-03-20
postgresdb-operator,kabisa,,https://github.com/kabisa/postgresdb-operator,0,1,26,48,2019-10-21,2023-01-24
opentelemetry-operator,open-telemetry,Kubernetes Operator for OpenTelemetry Collector,https://github.com/open-telemetry/opentelemetry-operator,265,686,24,802,2019-12-18,2023-03-20
argocd-operator,argoproj-labs,A Kubernetes operator for managing Argo CD clusters.,https://github.com/argoproj-labs/argocd-operator,132,379,15,711,2019-12-04,2023-03-20
terraform-k8s,hashicorp,Terraform Cloud Operator for Kubernetes,https://github.com/hashicorp/terraform-k8s,62,367,27,142,2019-12-04,2023-03-13
vitess-operator,planetscale,Kubernetes Operator for Vitess,https://github.com/planetscale/vitess-operator,56,219,36,346,2019-12-03,2023-03-20
compose-spec,compose-spec,The Compose specification,https://github.com/compose-spec/compose-spec,703,1606,56,299,2019-12-10,2023-03-20
piraeus,piraeusdatastore,High Available Datastore for Kubernetes,https://github.com/piraeusdatastore/piraeus,39,361,14,287,2019-12-05,2023-01-31
system-upgrade-controller,rancher,"In your Kubernetes, upgrading your nodes",https://github.com/rancher/system-upgrade-controller,65,462,19,132,2019-12-23,2023-03-15
egress-operator,monzo,A Kubernetes operator to produce egress gateway Envoy pods and control access to them with network policies,https://github.com/monzo/egress-operator,21,224,69,64,2019-12-11,2023-03-09
terraform-helm,hashicorp,Helm chart to install Terraform Cloud Operator and other associated components.,https://github.com/hashicorp/terraform-helm,31,71,18,77,2019-12-17,2023-03-13
virtual-environment,alibaba,Route isolation with service sharing https://alibaba.github.io/virtual-environment/#/zh-cn/,https://github.com/alibaba/virtual-environment,38,196,16,270,2019-12-24,2023-03-06
cloud-ingress-operator,openshift,"Operator to manage cloud Ingress/Load balancer scheme, switching between public/private modes",https://github.com/openshift/cloud-ingress-operator,53,17,45,592,2019-12-10,2023-02-27
velero-plugin-for-vsphere,vmware-tanzu,Plugin to support Velero on vSphere,https://github.com/vmware-tanzu/velero-plugin-for-vsphere,46,46,16,575,2019-12-20,2023-03-03
file-integrity-operator,openshift,Operator providing OpenShift cluster node file integrity checking,https://github.com/openshift/file-integrity-operator,24,29,18,650,2019-12-03,2023-03-20
whereabouts-cni,openshift,Cluster-wide IPAM CNI plugin,https://github.com/openshift/whereabouts-cni,20,22,17,473,2019-12-11,2023-03-20
infinibox-csi-driver,Infinidat,,https://github.com/Infinidat/infinibox-csi-driver,10,2,13,578,2019-12-19,2023-02-27
PoC-in-GitHub,nomi-sec,📡 PoC auto collect from GitHub. ⚠️ Be careful Malware.,https://github.com/nomi-sec/PoC-in-GitHub,946,4781,369,4741,2019-12-08,2023-03-21
kubetools,collabnix,Kubetools - Curated List of Kubernetes Tools,https://github.com/collabnix/kubetools,250,854,41,547,2020-01-11,2023-03-19
airflow-on-k8s-operator,apache,Airflow on Kubernetes Operator,https://github.com/apache/airflow-on-k8s-operator,27,86,28,17,2020-01-15,2023-02-06
hub,artifacthub,"Find, install and publish Kubernetes packages",https://github.com/artifacthub/hub,175,1200,26,1701,2020-01-14,2023-03-20
charts,streamnative,"StreamNative Helm Charts Repository: Apache Pulsar, Pulsar Operators, StreamNative Platform, Function Mesh",https://github.com/streamnative/charts,62,74,33,711,2020-01-05,2023-03-21
cf-for-k8s,cloudfoundry,The open source deployment manifest for Cloud Foundry on Kubernetes,https://github.com/cloudfoundry/cf-for-k8s,118,304,57,2657,2020-01-28,2022-08-03
ibm-spectrum-scale-csi,IBM,"The IBM Spectrum Scale Container Storage Interface (CSI) project enables container orchestrators, such as Kubernetes and OpenShift, to manage the life-cycle of persistent storage.",https://github.com/IBM/ibm-spectrum-scale-csi,34,50,16,1362,2020-01-17,2023-03-21
newrelic-kubernetes-operator,newrelic,Operator to create New Relic configuration in Kubernetes,https://github.com/newrelic/newrelic-kubernetes-operator,15,39,17,397,2020-01-24,2023-03-18
bookkeeper-operator,pravega,Kubernetes Operator for bookkeeper,https://github.com/pravega/bookkeeper-operator,18,13,12,108,2020-01-16,2023-02-17
awesome-learn,csantanapr,Cloud Native Learning Path,https://github.com/csantanapr/awesome-learn,29,167,18,20,2020-01-29,2022-10-13
keepalived-operator,redhat-cop,An operator to manage VIPs backed by keepalived,https://github.com/redhat-cop/keepalived-operator,34,110,13,155,2020-01-30,2023-03-11
cnf-testsuite,cncf,📞📱☎️📡🌐 CNF Test Suite is a tool to check for and provide feedback on the use of K8s + cloud native best practices in networking applications and platforms.,https://github.com/cncf/cnf-testsuite,54,134,15,5312,2020-01-17,2023-03-21
cli,civo,Our Command Line Interface (CLI) for interacting with your Civo resources,https://github.com/civo/cli,60,145,13,649,2020-01-21,2023-03-09
cnf-features-deploy,openshift-kni,Kustomize configs for installing CNF features and e2e functional tests for verifying feature deployment/integration,https://github.com/openshift-kni/cnf-features-deploy,113,46,15,1923,2020-01-09,2023-03-18
ibm-iam-operator,IBM,Operator used to install the common iam service,https://github.com/IBM/ibm-iam-operator,20,10,13,426,2020-01-21,2023-03-21
registration,mosip,This repository contains modules for registration of an Individual,https://github.com/mosip/registration,103,3,10,28794,2020-01-17,2023-03-20
ibm-cert-manager-operator,IBM,Operator used to manage the ibm cert-manager service,https://github.com/IBM/ibm-cert-manager-operator,18,6,10,158,2020-01-14,2023-03-20
awesome-k6,grafana,A curated list of resources on automated load- and performance testing using k6 🗻,https://github.com/grafana/awesome-k6,42,359,126,77,2020-01-28,2022-09-30
Blockchain-for-maintaining-Digital-Assets,IBM,,https://github.com/IBM/Blockchain-for-maintaining-Digital-Assets,29,33,13,87,2020-01-06,2023-01-01
etcd-backup-operator,giantswarm,Creates etcd backups and uploads them to AWS S3,https://github.com/giantswarm/etcd-backup-operator,4,3,12,404,2020-01-09,2023-03-15
ibm-platform-api-operator,IBM,This operator provides IBM command line interface to manage cloud resources,https://github.com/IBM/ibm-platform-api-operator,17,2,12,222,2020-01-20,2023-03-20
cloud-service-broker,cloudfoundry,OSBAPI service broker that uses Terraform to provision and bind services. Derived from https://github.com/GoogleCloudPlatform/gcp-service-broker,https://github.com/cloudfoundry/cloud-service-broker,33,69,11,2149,2020-01-09,2023-03-17
ibm-auditlogging-operator,IBM,Operator used to install IBM audit logging service,https://github.com/IBM/ibm-auditlogging-operator,8,4,12,353,2020-01-21,2023-03-20
terraform-modules,boldare,Collection of Terraform modules simplifying project setup.,https://github.com/boldare/terraform-modules,1,10,25,130,2020-01-07,2022-10-12
iot-solution-accelerator,AzureCosmosDB,,https://github.com/AzureCosmosDB/iot-solution-accelerator,10,30,16,84,2020-01-10,2022-12-08
mongodb-kubernetes-operator,mongodb,MongoDB Community Kubernetes Operator,https://github.com/mongodb/mongodb-kubernetes-operator,391,855,40,645,2020-02-17,2023-03-20
arkade,alexellis,Open Source Marketplace For Kubernetes,https://github.com/alexellis/arkade,247,3382,36,753,2020-02-26,2023-03-20
cstor-operators,openebs,Collection of OpenEBS cStor Data Engine Operators,https://github.com/openebs/cstor-operators,65,82,14,298,2020-02-12,2023-02-25
skywalking-swck,apache,Apache SkyWalking Cloud on Kubernetes,https://github.com/apache/skywalking-swck,37,95,41,101,2020-02-19,2023-02-23
bottlerocket-update-operator,bottlerocket-os,A Kubernetes operator for automated updates to Bottlerocket,https://github.com/bottlerocket-os/bottlerocket-update-operator,28,131,22,651,2020-02-14,2023-03-21
windows-machine-config-operator,openshift,Windows MCO for OpenShift that handles addition of Windows nodes to the cluster,https://github.com/openshift/windows-machine-config-operator,54,35,24,1529,2020-02-17,2023-03-20
spec,servicebinding,Specification for binding services to k8s workloads,https://github.com/servicebinding/spec,33,75,12,402,2020-02-12,2022-12-10
che-dashboard,eclipse-che,,https://github.com/eclipse-che/che-dashboard,49,16,30,1906,2020-02-13,2023-03-20
tlaplus-monitor,onosproject,Tools for conformance monitoring on Kubernetes with TLA+,https://github.com/onosproject/tlaplus-monitor,7,17,14,24,2020-02-25,2022-07-11
kubernetes-image-puller,che-incubator,Kubernetes Image Puller is used for caching images on a cluster. It creates a DaemonSet downloading and running the relevant container images on each node.,https://github.com/che-incubator/kubernetes-image-puller,20,52,13,183,2020-02-03,2023-03-08
example-bank,IBM,Deploy a customer loyalty back-end application with Java and Node microservices on IBM’s managed OpenShift.,https://github.com/IBM/example-bank,98,52,16,182,2020-02-03,2023-01-09
network-metrics-daemon,openshift,network-metrics-daemon is a daemon component that collects and publishes network related metrics,https://github.com/openshift/network-metrics-daemon,23,15,17,52,2020-02-11,2023-03-17
knausj_talon,knausj85,"Config for talon for Mac, Windows and Linux. Very much in progress.",https://github.com/knausj85/knausj_talon,629,403,16,1556,2020-02-13,2023-03-21
management-api-for-apache-cassandra,k8ssandra,RESTful / Secure Management Sidecar for Apache Cassandra,https://github.com/k8ssandra/management-api-for-apache-cassandra,36,59,33,254,2020-02-12,2023-03-10
coherence,oracle,Oracle Coherence Community Edition,https://github.com/oracle/coherence,66,385,29,2082,2020-02-24,2023-03-21
terraform-kubernetes-gke-nfs,kiwicom,,https://github.com/kiwicom/terraform-kubernetes-gke-nfs,3,0,10,13,2020-02-10,2022-07-15
entando-sample-app,entando-k8s,,https://github.com/entando-k8s/entando-sample-app,0,0,10,113,2020-02-05,2022-09-22
apigateway-openlogging-elk,Axway-API-Management-Plus,Monitor API-Gateway realtime based on Elasticsearch (Elastic-Stack),https://github.com/Axway-API-Management-Plus/apigateway-openlogging-elk,16,27,16,1959,2020-02-14,2022-12-14
starboard,aquasecurity,Moved to https://github.com/aquasecurity/trivy-operator,https://github.com/aquasecurity/starboard,201,1303,26,710,2020-03-17,2023-03-20
redis-operator,OT-CONTAINER-KIT,A golang based redis operator that will make/oversee Redis standalone/cluster mode setup on top of the Kubernetes.,https://github.com/OT-CONTAINER-KIT/redis-operator,136,435,15,396,2020-03-31,2023-03-21
harbor-operator,goharbor,Kubernetes operator for Harbor service components,https://github.com/goharbor/harbor-operator,87,294,29,1035,2020-03-11,2023-03-10
cass-operator,datastax,The DataStax Kubernetes Operator for Apache Cassandra,https://github.com/datastax/cass-operator,79,250,25,404,2020-03-13,2023-02-25
docs-tidb-operator,pingcap,Documentation for TiDB on Kubernetes in both English and Chinese.,https://github.com/pingcap/docs-tidb-operator,105,40,87,1199,2020-03-06,2023-03-20
sidekick,minio,High Performance HTTP Sidecar Load Balancer,https://github.com/minio/sidekick,62,472,20,107,2020-03-05,2023-02-18
tobs,timescale,tobs - The Observability Stack for Kubernetes. Easy install of a full observability stack into a k8s cluster with Helm charts.,https://github.com/timescale/tobs,59,522,19,923,2020-03-30,2023-03-17
deploy,stolostron,Deploy Development Builds of Open Cluster Management (OCM) on RedHat Openshift Container Platform,https://github.com/stolostron/deploy,143,138,22,2122,2020-03-09,2023-03-20
api,open-cluster-management-io,Core APIs for open cluster management,https://github.com/open-cluster-management-io/api,68,217,11,242,2020-03-11,2023-03-21
nginx-ingress-operator,nginxinc,WARNING - DEPRECATION NOTICE: The NGINX Ingress Operator has been updated to be a Helm based operator. This repo has been deprecated and will soon be archived - the new NGINX Ingress Operator repo can be found at https://github.com/nginxinc/nginx-ingress-helm-operator.,https://github.com/nginxinc/nginx-ingress-operator,30,63,11,191,2020-03-20,2022-11-14
CrownLabs,netgroup-polito,Kubernetes-based Remote Laboratories,https://github.com/netgroup-polito/CrownLabs,33,96,10,1532,2020-03-09,2023-03-06
cerberus,redhat-chaos,Guardian of Kubernetes and OpenShift clusters. Tool to monitor clusters health and signal/alert on failures.,https://github.com/redhat-chaos/cerberus,40,79,14,141,2020-03-12,2023-03-06
vm-operator-api,vmware-tanzu,"A client API for the VM Operator project, designed to allow for integration with vSphere 7 with Kubernetes",https://github.com/vmware-tanzu/vm-operator-api,30,60,17,95,2020-03-17,2023-03-07
multicluster-observability-operator,stolostron,Operator for Multi-Cluster Monitoring with Thanos.,https://github.com/stolostron/multicluster-observability-operator,44,40,14,1344,2020-03-26,2023-03-18
kube-secret-syncer,contentful-labs,A Kubernetes operator to sync secrets from AWS Secrets Manager,https://github.com/contentful-labs/kube-secret-syncer,10,190,10,135,2020-03-15,2023-02-15
egressip-ipam-operator,redhat-cop,egressip-ipam-operator,https://github.com/redhat-cop/egressip-ipam-operator,22,31,13,101,2020-03-04,2023-02-15
dell-csi-operator,dell,A repo for the CSI operator for all Dell storage arrays,https://github.com/dell/dell-csi-operator,12,18,19,183,2020-03-27,2023-03-20
gemini,FairwindsOps,[alpha] Automated backups of PersistentVolumeClaims in Kubernetes using VolumeSnapshots,https://github.com/FairwindsOps/gemini,19,242,20,187,2020-03-28,2023-03-20
samsahai,agoda-com,Dependencies verification system with Kubernetes Operator,https://github.com/agoda-com/samsahai,9,71,10,202,2020-03-17,2023-03-07
k8s-image-availability-exporter,deckhouse,Alert if an image used in Kubernetes cannot be pulled from container registry,https://github.com/deckhouse/k8s-image-availability-exporter,18,162,11,56,2020-03-27,2023-03-01
aiven-operator,aiven,Provision and manage Aiven Services from your Kubernetes cluster.,https://github.com/aiven/aiven-operator,10,19,65,452,2020-03-04,2023-03-20
Celery-Kubernetes-Operator,celery,An operator to manage celery clusters on Kubernetes (Work in Progress),https://github.com/celery/Celery-Kubernetes-Operator,6,68,10,56,2020-03-29,2023-02-16
charmhub.io,canonical,,https://github.com/canonical/charmhub.io,23,7,15,878,2020-03-09,2023-03-20
kubernetes-image-puller-operator,che-incubator,,https://github.com/che-incubator/kubernetes-image-puller-operator,5,13,11,157,2020-03-04,2023-01-17
orchestrate-kubernetes,ConsenSys,Orchestrate deployment scripts kubernetes example,https://github.com/ConsenSys/orchestrate-kubernetes,10,17,20,100,2020-03-09,2022-09-07
helm-charts,temporalio,Temporal Helm charts,https://github.com/temporalio/helm-charts,212,169,21,303,2020-03-20,2023-03-17
koperator-docs,banzaicloud,Documentation for Koperator - the operator for managing Apache Kafka on Kubernetes,https://github.com/banzaicloud/koperator-docs,15,4,10,283,2020-03-16,2023-03-17
che-release,eclipse-che,Eclipse Che release orchestration scripts and tools,https://github.com/eclipse-che/che-release,15,0,31,405,2020-03-30,2023-01-25
dea-airflow,GeoscienceAustralia,,https://github.com/GeoscienceAustralia/dea-airflow,17,28,22,2600,2020-03-17,2023-03-21
cass-config-builder,datastax,Configuration builder for Apache Cassandra based on definitions at datastax/cass-config-definitions,https://github.com/datastax/cass-config-builder,18,7,12,82,2020-03-13,2023-03-20
flipop,digitalocean,Floating IP Controller for Kubernetes,https://github.com/digitalocean/flipop,3,20,96,36,2020-03-09,2023-02-25
terraform-aws-eks-jx,jenkins-x,A Terraform module for creating Jenkins X infrastructure on AWS,https://github.com/jenkins-x/terraform-aws-eks-jx,25,61,23,209,2020-03-06,2022-11-29
aaw-kubeflow-manifests,StatCan,Kustomize installation manifests for Kubeflow,https://github.com/StatCan/aaw-kubeflow-manifests,4,7,12,214,2020-03-30,2023-03-16
IBM-db2-blockchain-insurance-application,IBM,Leveraging IBM DB2’s Federation Capabilities to Perform SQL Analytics on a Sample Blockchain Insurance Application using Hyperledger Fabric,https://github.com/IBM/IBM-db2-blockchain-insurance-application,14,8,13,9,2020-03-23,2022-12-10
insights-docs,FairwindsOps,Documentation for Fairwinds Insights,https://github.com/FairwindsOps/insights-docs,4,2,19,673,2020-03-10,2023-03-20
prometheus-parser-rs,HewlettPackard,a Rust library for parsing and validating Prometheus query expressions,https://github.com/HewlettPackard/prometheus-parser-rs,4,9,11,8,2020-03-24,2023-01-05
izpbx,ugoviti,izPBX is a Turnkey Cloud Native Telephony System powered by Asterisk Engine and FreePBX Management GUI,https://github.com/ugoviti/izpbx,41,87,10,587,2020-03-23,2023-03-17
kube-app-testing,giantswarm,Use KIND to test application deployment using app-operator and chart-operator,https://github.com/giantswarm/kube-app-testing,1,1,16,148,2020-03-25,2023-01-23
