Name,Owner,Desc,url,forks,stars,commits,watches,created_at,pushed_at
compliantkubernetes-apps,elastisys,"Elastisys Compliant Kubernetes is an open source, Certified Kubernetes distribution designed according to the ISO27001 controls: providing you with security tooling and observability from day one.",https://github.com/elastisys/compliantkubernetes-apps,8,33,10,832,2020-10-30,2023-03-20
horusec-docs,ZupIT,Horusec oficial documentation,https://github.com/ZupIT/horusec-docs,16,10,29,166,2020-10-22,2022-07-10
graylog-k8s-operator,canonical,Graylog operator for ingesting logs written for Juju and the Operator Framework.,https://github.com/canonical/graylog-k8s-operator,5,3,12,13,2020-10-15,2022-07-07
docs-mysql-k8s,pivotal-cf,,https://github.com/pivotal-cf/docs-mysql-k8s,4,1,30,735,2020-10-26,2023-03-14
delight,datamechanics,"A Spark UI and Spark History Server alternative with CPU and Memory metrics! Delight is free, cross-platform, and open-source.",https://github.com/datamechanics/delight,47,300,15,56,2020-10-26,2023-03-09
pythonoperatorframework.io,canonical,,https://github.com/canonical/pythonoperatorframework.io,5,0,12,116,2020-10-22,2023-03-15
website,servicebinding,"Repository hosting the website files (guides, etc)",https://github.com/servicebinding/website,2,0,10,52,2020-10-29,2022-08-08
appeal-planning-decision,Planning-Inspectorate,Planning Inspectorate appeals website,https://github.com/Planning-Inspectorate/appeal-planning-decision,5,4,11,3440,2020-10-12,2023-03-20
app-admission-controller,giantswarm,A Kubernetes admission controller for app CRs that is a part of the Giant Swarm app platform.,https://github.com/giantswarm/app-admission-controller,2,0,12,251,2020-10-07,2023-03-15
akka-projection-testing,akka,End-to-end testing of Projections,https://github.com/akka/akka-projection-testing,4,1,10,34,2020-10-23,2023-03-14
iot-kubernetes-monitoring-esp,sassoftware,"Learn how to setup the SAS ESP monitoring stack to query, visualize, alert on, and explore metrics for ESP projects.",https://github.com/sassoftware/iot-kubernetes-monitoring-esp,0,0,10,64,2020-10-05,2023-01-04
external-secrets,external-secrets,External Secrets Operator reads information from a third-party service like AWS Secrets Manager and automatically injects the values as Kubernetes Secrets.,https://github.com/external-secrets/external-secrets,445,2450,34,2175,2020-11-17,2023-03-20
onepassword-operator,1Password,The 1Password Connect Kubernetes Operator provides the ability to integrate Kubernetes Secrets with 1Password. The operator also handles autorestarting deployments when 1Password items are updated.,https://github.com/1Password/onepassword-operator,52,372,21,220,2020-12-09,2023-03-18
bevel-operator-fabric,hyperledger,Hyperledger Fabric Kubernetes operator - Hyperledger Fabric operator for Kubernetes (v2.3+),https://github.com/hyperledger/bevel-operator-fabric,60,186,40,218,2020-11-29,2023-03-13
kubernetes-101,geerlingguy,Kubernetes 101 - by Jeff Geerling,https://github.com/geerlingguy/kubernetes-101,139,461,42,110,2020-11-05,2022-11-27
kubeeye,kubesphere,"KubeEye aims to find various problems on Kubernetes, such as application misconfiguration, unhealthy cluster components and node problems.",https://github.com/kubesphere/kubeeye,116,679,18,309,2020-11-07,2023-03-01
mongodb-atlas-kubernetes,mongodb,MongoDB Atlas Kubernetes Operator - Manage your MongoDB Atlas clusters from Kubernetes,https://github.com/mongodb/mongodb-atlas-kubernetes,56,88,16,519,2020-11-03,2023-03-20
cilium-cli,cilium,"CLI to install, manage & troubleshoot Kubernetes clusters running Cilium",https://github.com/cilium/cilium-cli,120,207,34,1410,2020-12-22,2023-03-21
sriov-network-operator,k8snetworkplumbingwg,Operator for provisioning and configuring SR-IOV CNI plugin and device plugin,https://github.com/k8snetworkplumbingwg/sriov-network-operator,79,50,11,1361,2020-11-20,2023-03-20
operator-framework-olm,openshift,A management framework for extending Kubernetes with Operators,https://github.com/openshift/operator-framework-olm,45,10,12,8775,2020-12-02,2023-03-20
lvm-localpv,openebs,CSI Driver for dynamic provisioning of Persistent Local Volumes for Kubernetes using LVM.,https://github.com/openebs/lvm-localpv,63,146,16,182,2020-12-23,2023-02-27
dynamic-nfs-provisioner,openebs,Operator for dynamically provisioning an NFS server on any Kubernetes Persistent Volume. Also creates an NFS volume on the dynamically provisioned server for enabling Kubernetes RWX volumes.,https://github.com/openebs/dynamic-nfs-provisioner,48,105,16,112,2020-11-09,2023-02-27
app-services-operator,redhat-developer,OpenShift Operator for binding Red Hat OpenShift Application Services,https://github.com/redhat-developer/app-services-operator,25,13,25,549,2020-11-03,2023-02-17
observability-operator,redhat-developer,Operator installing the Telemetry stack in a Kubernetes cluster and installing the metrics and alerts,https://github.com/redhat-developer/observability-operator,31,14,29,558,2020-12-03,2023-03-20
special-resource-operator,openshift,SRO supports out-of-tree and third-party kernel drivers and the support software for the node OS via containers.,https://github.com/openshift/special-resource-operator,40,16,14,176,2020-11-06,2023-03-14
integration-studio,wso2,WSO2 Integration Studio is a development environment used to design integration scenarios and develop them.,https://github.com/wso2/integration-studio,45,22,95,9360,2020-12-07,2023-03-14
onos-operator,onosproject,Kubernetes operator for µONOS/SD-RAN,https://github.com/onosproject/onos-operator,10,7,23,143,2020-12-01,2023-02-16
cnf-wg,cncf,"The focus of the CNF WG determine Cloud native best practices of networking applications, aka CNFs",https://github.com/cncf/cnf-wg,46,79,30,523,2020-11-18,2023-03-16
application-modernization-javaee-quarkus,IBM,Application Modernization Sample - From Java EE (2010) to Cloud-Native (2021),https://github.com/IBM/application-modernization-javaee-quarkus,61,104,12,321,2020-11-23,2022-10-02
mongodb-k8s-operator,canonical,Operator charm for MongoDB,https://github.com/canonical/mongodb-k8s-operator,12,9,15,117,2020-11-12,2023-03-20
xjoin-operator,RedHatInsights,,https://github.com/RedHatInsights/xjoin-operator,11,2,36,521,2020-12-09,2023-03-21
100-go-mistakes,teivah,📖 100 Go Mistakes and How to Avoid Them,https://github.com/teivah/100-go-mistakes,263,4523,47,125,2020-12-12,2023-02-21
elastic-phenix-operator,Carrefour-Group,"elastic-phenix-operator is a kubernetes operator to manage elasticsearch resources: Indices, Templates, ...",https://github.com/Carrefour-Group/elastic-phenix-operator,3,27,15,103,2020-11-26,2022-11-25
RISC-V-Guide,mikeroyal,RISC-V Guide. Learn all about the RISC-V computer architecture along with the Development Tools and Operating Systems to develop on RISC-V hardware.,https://github.com/mikeroyal/RISC-V-Guide,19,281,11,59,2020-12-15,2023-01-25
silence-operator,giantswarm,silence-operator manages Alertmanager silences via custom resources,https://github.com/giantswarm/silence-operator,3,25,12,214,2020-11-01,2023-03-15
awesome-restic,rubiojr,Awesome Restic related projects,https://github.com/rubiojr/awesome-restic,4,106,10,26,2020-11-30,2023-02-10
workshops,pulumi,A definitive place to store all the Pulumi workshops,https://github.com/pulumi/workshops,19,37,15,112,2020-11-12,2023-03-15
polymesh-tools,PolymeshAssociation,Tools and files to support polymesh deployments,https://github.com/PolymeshAssociation/polymesh-tools,7,4,10,35,2020-11-10,2023-03-13
mysql-k8s-operator,canonical,,https://github.com/canonical/mysql-k8s-operator,9,2,15,263,2020-11-30,2023-03-20
data-infra,cal-itp,Cal-ITP data infrastructure,https://github.com/cal-itp/data-infra,10,21,13,3795,2020-11-16,2023-03-21
pulsar-helm-chart,datastax,Apache Pulsar Helm chart,https://github.com/datastax/pulsar-helm-chart,36,35,13,308,2020-12-23,2023-02-23
k3d-action,AbsaOSS,"A GitHub Action to run lightweight ephemeral Kubernetes clusters during workflow.  Fundamental advantage of this action is a full customization of embedded k3s clusters. In addition, it provides a private image registry and multi-cluster support.",https://github.com/AbsaOSS/k3d-action,20,137,10,87,2020-12-10,2023-03-19
sdran-in-a-box,onosproject,SDRAN-in-a-Box for SD-RAN project,https://github.com/onosproject/sdran-in-a-box,28,13,15,179,2020-11-20,2023-01-05
onos-kpimon,onosproject,KPIMON xAPP for ONOS SD-RAN (µONOS Architecture),https://github.com/onosproject/onos-kpimon,10,3,14,218,2020-11-03,2023-01-04
ArchitectureWeekly,oskardudycz,Architecture Weekly - links and resources to boost your knowledge and developer skills,https://github.com/oskardudycz/ArchitectureWeekly,67,1044,189,380,2020-12-07,2023-03-20
cx-operator,coralogix,Coralogix Kubernetes Operator,https://github.com/coralogix/cx-operator,0,15,34,141,2020-12-21,2023-03-07
strimzi-canary,strimzi,Strimzi canary,https://github.com/strimzi/strimzi-canary,20,28,12,157,2020-11-10,2023-03-20
k8s-audit-metrics,giantswarm,Kubernetes apiserver audit log metrics exporter,https://github.com/giantswarm/k8s-audit-metrics,3,2,12,128,2020-11-30,2023-03-15
reference,Fechin,⭕ Share quick reference cheat sheet for developers.,https://github.com/Fechin/reference,385,2240,21,560,2020-12-19,2023-03-19
crossplane-service-broker,vshn,Crossplane Open Service Broker API,https://github.com/vshn/crossplane-service-broker,0,17,12,156,2020-12-03,2023-03-16
iris-k3s,kuszewski,,https://github.com/kuszewski/iris-k3s,0,3,11,26,2020-11-19,2022-08-18
kubectl-cnp,EnterpriseDB,Plugin for kubectl to manage a Cloud Native PostgreSQL cluster in Kubernetes,https://github.com/EnterpriseDB/kubectl-cnp,1,3,15,3,2020-11-26,2023-03-20
spring-k8s-recipes,vmware-archive,Recipes for deploying Spring + Tanzu Products to Kubernetes,https://github.com/vmware-archive/spring-k8s-recipes,1,0,18,7,2020-11-12,2022-07-19
awesome-colab-notebooks,amrzv,Collection of google colaboratory notebooks for fast and easy experiments,https://github.com/amrzv/awesome-colab-notebooks,128,720,31,42,2020-12-27,2023-03-14
conditions-handler,giantswarm,Handlers for reconciling Cluster API conditions,https://github.com/giantswarm/conditions-handler,1,1,11,32,2020-11-23,2023-03-18
linux-audit-exporter,TeachersPayTeachers,Export Linux audit status as Prometheus metrics,https://github.com/TeachersPayTeachers/linux-audit-exporter,1,8,34,17,2020-12-03,2023-01-20
dqmgui,cms-DQM,CMS DQM GUI code,https://github.com/cms-DQM/dqmgui,6,4,13,164,2020-11-11,2022-10-31
sap-btp-service-operator,SAP,SAP BTP service operator enables developers to connect Kubernetes clusters to SAP BTP accounts and to consume SAP BTP services within the clusters by using Kubernetes native tools.,https://github.com/SAP/sap-btp-service-operator,40,104,10,183,2021-01-27,2023-03-21
connect-helm-charts,1Password,Helm Charts for deploying 1Password Connect and the 1Password Connect Kubernetes Operator,https://github.com/1Password/connect-helm-charts,43,56,13,260,2021-01-25,2023-03-07
cluster-api-provider-bringyourownhost,vmware-tanzu,Kubernetes Cluster API Provider BYOH for already-provisioned hosts running Linux.,https://github.com/vmware-tanzu/cluster-api-provider-bringyourownhost,52,165,15,666,2021-01-25,2023-03-20
aks-operator,rancher,,https://github.com/rancher/aks-operator,20,6,23,251,2021-01-08,2023-03-20
gke-operator,rancher,,https://github.com/rancher/gke-operator,16,7,24,200,2021-01-08,2023-02-25
kas-fleetshard,bf2fc6cc711aee1a0c2a,The kas-fleetshard-operator is responsible for provisioning and managing instances of kafka on a cluster.  The kas-fleetshard-synchronizer synchronizes the state of a fleet shard with the kas-fleet-manager.,https://github.com/bf2fc6cc711aee1a0c2a/kas-fleetshard,21,9,19,902,2021-01-04,2023-03-15
easemesh,megaease,"A service mesh implementation for connecting,  control, and observe services in spring-cloud.",https://github.com/megaease/easemesh,49,460,20,226,2021-02-01,2022-12-02
beegfs-csi-driver,NetApp,The BeeGFS Container Storage Interface (CSI) driver provides high performing and scalable storage for workloads running in Kubernetes.,https://github.com/NetApp/beegfs-csi-driver,16,48,16,801,2021-02-01,2022-12-13
k8s-wso2is-operator,wso2,Identity Server Kubernetes Controller,https://github.com/wso2/k8s-wso2is-operator,5,8,61,62,2021-01-15,2023-03-15
aws-privateca-issuer,cert-manager,Addon for cert-manager that issues certificates using AWS ACM PCA.,https://github.com/cert-manager/aws-privateca-issuer,54,125,12,372,2021-01-13,2023-03-20
redis-k8s-operator,canonical,Operator Charm for Redis,https://github.com/canonical/redis-k8s-operator,6,2,15,61,2021-01-28,2023-03-03
applicationset-progressive-sync,Skyscanner,Progressive sync controller for Argo ApplicationSet,https://github.com/Skyscanner/applicationset-progressive-sync,4,104,13,117,2021-01-28,2023-01-31
tackle-pathfinder,konveyor,Tackle Pathfinder application,https://github.com/konveyor/tackle-pathfinder,18,13,10,53,2021-01-27,2023-03-15
tf-operator,tungstenfabric,,https://github.com/tungstenfabric/tf-operator,3,4,10,417,2021-01-25,2023-01-30
orchestrate-helm,ConsenSys,This GitHub project is the source for Orchestrate Helm chart repositories.,https://github.com/ConsenSys/orchestrate-helm,3,8,24,34,2021-01-11,2022-09-13
app-services-openshift-console-plugin,redhat-developer,OpenShift UI Console Plugin for RHOAS (Fork of https://github.com/openshift/console),https://github.com/redhat-developer/app-services-openshift-console-plugin,3,1,20,19934,2021-01-11,2022-11-08
tackle-controls,migtools,Tackle Controls Application,https://github.com/migtools/tackle-controls,7,2,10,75,2021-01-27,2023-03-06
acc-provision-operator,noironetworks,Kubernetes Operator that manages the lifecycle of the ACI CNI.,https://github.com/noironetworks/acc-provision-operator,0,0,15,30,2021-01-26,2023-03-21
sak-scaling,provectus,ASG and HPA module for SAK project,https://github.com/provectus/sak-scaling,1,0,89,32,2021-01-21,2023-02-17
flink-on-k8s-operator,spotify,Kubernetes operator for managing the lifecycle of Apache Flink and Beam applications.,https://github.com/spotify/flink-on-k8s-operator,64,144,13,682,2021-02-05,2023-03-20
solr,apache,Apache Solr open-source search software,https://github.com/apache/solr,449,683,52,36528,2021-02-23,2023-03-21
messaging-topology-operator,rabbitmq,RabbitMQ messaging topology operator,https://github.com/rabbitmq/messaging-topology-operator,38,76,12,698,2021-02-16,2023-03-20
vm-operator,vmware-tanzu,Self-service manage your virtual infrastructure...,https://github.com/vmware-tanzu/vm-operator,22,69,16,896,2021-02-19,2023-03-20
howtheysre,upgundecha,A curated collection of publicly available resources on how technology and tech-savvy organizations around the world practice Site Reliability Engineering (SRE),https://github.com/upgundecha/howtheysre,665,8229,237,297,2021-02-14,2023-03-13
vsphere-kubernetes-drivers-operator,vmware-tanzu,vSphere Kubernetes Driver Operator to simplify and automate the lifecycle management of CSI and CPI for Kubernetes cluster running on vSphere,https://github.com/vmware-tanzu/vsphere-kubernetes-drivers-operator,9,26,20,111,2021-02-19,2023-03-17
awesome-software-architecture,mehdihadeli,"A curated list of awesome articles, videos, and other resources to learn and practice software architecture, patterns, and principles.",https://github.com/mehdihadeli/awesome-software-architecture,104,1450,39,516,2021-02-06,2023-03-19
chaosblade-box,chaosblade-io,chaos-platform,https://github.com/chaosblade-io/chaosblade-box,74,185,21,40,2021-02-02,2022-12-09
learn-terraform-kubernetes-operator,hashicorp,,https://github.com/hashicorp/learn-terraform-kubernetes-operator,12,5,10,20,2021-02-12,2023-03-08
howtheyaws,upgundecha,A curated collection of publicly available resources on how technology and tech-savvy organizations around the world use Amazon Web Services (AWS),https://github.com/upgundecha/howtheyaws,76,597,31,33,2021-02-17,2023-03-10
cloud-network-config-controller,openshift,OpenShift cloud network configuration management,https://github.com/openshift/cloud-network-config-controller,23,0,13,148,2021-02-08,2023-03-15
awesome-runners,jonico,A curated list of awesome self-hosted GitHub Action runners in a large comparison matrix,https://github.com/jonico/awesome-runners,34,508,22,89,2021-02-05,2023-01-23
azure.liberty.aks,WASdev,,https://github.com/WASdev/azure.liberty.aks,6,1,10,272,2021-02-26,2023-03-01
prometheus-alert-readiness,coralogix,Translate Prometheus Alerts into Kubernetes pod readiness,https://github.com/coralogix/prometheus-alert-readiness,0,21,34,26,2021-02-10,2023-03-05
awesome-quincy-larson-emails,sourabh-joshi,This repository is an archive of emails that are sent by the awesome Quincy Larson every week.,https://github.com/sourabh-joshi/awesome-quincy-larson-emails,121,1012,80,194,2021-02-16,2023-03-14
awesome-high-performance-computing,trevor-vincent,A curated list of awesome high performance computing resources,https://github.com/trevor-vincent/awesome-high-performance-computing,9,136,10,394,2021-02-26,2023-03-12
kcp,kcp-dev,kcp is a Kubernetes-like control plane for workloads on many clusters,https://github.com/kcp-dev/kcp,323,1916,36,5087,2021-03-31,2023-03-21
emqx-operator,emqx,A Kubernetes Operator for EMQX,https://github.com/emqx/emqx-operator,45,148,12,697,2021-03-26,2023-03-17
radondb-mysql-kubernetes,radondb,Open Source，High Availability Cluster，based on MySQL,https://github.com/radondb/radondb-mysql-kubernetes,63,274,11,613,2021-03-09,2023-03-21
percona-postgresql-operator,percona,Percona Operator for PostgreSQL,https://github.com/percona/percona-postgresql-operator,24,143,38,3193,2021-03-04,2023-03-20
multi-tenancy-gitops,cloud-native-toolkit,"Provides our opinionated point of view on how GitOps can be used to manage the infrastructure, services and application layers of K8s based systems",https://github.com/cloud-native-toolkit/multi-tenancy-gitops,730,91,13,234,2021-03-23,2023-03-19
cos-fleetshard,bf2fc6cc711aee1a0c2a,The cos-fleetshard-operator is responsible for provisioning and managing connectors instances on a cluster.,https://github.com/bf2fc6cc711aee1a0c2a/cos-fleetshard,21,7,26,871,2021-03-08,2023-03-20
aks-baseline-regulated,mspnp,This is the Azure Kubernetes Service (AKS) baseline cluster for regulated workloads reference implementation as produced by the Microsoft Azure Architecture Center.,https://github.com/mspnp/aks-baseline-regulated,85,93,11,77,2021-03-15,2023-03-20
tackle,konveyor,The Tackle project repositories contain tools that support the modernization and migration of applications to Kubernetes,https://github.com/konveyor/tackle,20,39,15,28,2021-03-25,2022-09-02
tutorial,networkpolicy,Kubernetes Network Policy Tutorial,https://github.com/networkpolicy/tutorial,20,74,11,4,2021-03-03,2022-11-24
aks-baseline-multi-region,mspnp,This is the Azure Kubernetes Service (AKS) baseline for multi-region reference implementation as produced by the Microsoft Azure Architecture Center.,https://github.com/mspnp/aks-baseline-multi-region,53,50,10,337,2021-03-23,2022-12-15
argocd-autopilot,argoproj-labs,Argo-CD Autopilot,https://github.com/argoproj-labs/argocd-autopilot,97,569,10,247,2021-03-05,2023-03-19
device-localpv,openebs,CSI Driver for using Local Block Devices,https://github.com/openebs/device-localpv,17,15,14,55,2021-03-10,2022-09-26
bigtable-autoscaler-operator,ResultadosDigitais,Kubernetes operator to autoscale Google's Cloud Bigtable clusters,https://github.com/ResultadosDigitais/bigtable-autoscaler-operator,2,22,20,186,2021-03-31,2023-02-03
supergraph-demo,apollographql,🍿 Compose subgraphs into a Federation v1 supergraph at build-time with static composition to power a federated graph router at runtime.,https://github.com/apollographql/supergraph-demo,43,114,10,668,2021-03-31,2023-03-17
cluster-image-scanner,SDA-SE,Discover vulnerabilities and container image misconfiguration in production environments.,https://github.com/SDA-SE/cluster-image-scanner,4,48,20,873,2021-03-22,2023-03-17
f5-ipam-controller,F5Networks,The F5 IPAM Controller runs in an orchestration environment like Kubernetes to allocate IP addresses from an IPAM system to BIG-IP Virtual Servers. The purpose is to abstract  complexity related to setting up BIG-IP from a networking perspective,https://github.com/F5Networks/f5-ipam-controller,16,6,12,132,2021-03-03,2023-03-02
driver-toolkit,openshift,driver-toolkit is a container with the kernel packages necessary for building driver containers for deploying kernel modules/drivers on OpenShift,https://github.com/openshift/driver-toolkit,20,5,15,125,2021-03-08,2023-03-20
k8s-api-docgen,EnterpriseDB,Reads Go source files to extract metadata about Kubernetes API custom resources defined by the developer in Godoc and produces different kinds of output - such as JSON or Markdown.,https://github.com/EnterpriseDB/k8s-api-docgen,0,4,18,11,2021-03-10,2023-01-11
rm-bucket-operator,EOEPCA,,https://github.com/EOEPCA/rm-bucket-operator,0,0,10,23,2021-03-09,2023-01-26
dns-operator-azure,giantswarm,DNS operator for Giant Swarm CAPZ clusters,https://github.com/giantswarm/dns-operator-azure,1,0,12,119,2021-03-16,2023-03-20
kubeflow-manifests,oneconvergence,,https://github.com/oneconvergence/kubeflow-manifests,0,0,13,845,2021-03-25,2022-09-20
kubegres,reactive-tech,"Kubegres is a Kubernetes operator allowing to deploy one or many clusters of PostgreSql instances and manage databases replication, failover and backup.",https://github.com/reactive-tech/kubegres,61,1142,20,107,2021-04-12,2023-03-15
sloth,slok,🦥 Easy and simple Prometheus SLO (service level objectives) generator,https://github.com/slok/sloth,114,1502,13,649,2021-04-06,2023-03-04
flux-cluster-template,onedr0p,"A community opinionated template for deploying a single Kubernetes cluster with Ansible and Terraform backed by Flux, SOPS, GitHub Actions, Renovate and more!",https://github.com/onedr0p/flux-cluster-template,159,1015,24,991,2021-04-14,2023-03-19
nebula-operator,vesoft-inc,Operation utilities for Nebula Graph,https://github.com/vesoft-inc/nebula-operator,21,57,22,109,2021-04-27,2023-03-02
vertica-kubernetes,vertica,"Operator, container and Helm chart to deploy Vertica in Kubernetes",https://github.com/vertica/vertica-kubernetes,17,24,13,332,2021-04-06,2023-03-17
jitsi-kubernetes-operator,jitsi-contrib,,https://github.com/jitsi-contrib/jitsi-kubernetes-operator,9,35,10,134,2021-04-30,2023-03-13
AWS-Guide,mikeroyal,"Amazon Web Services (AWS) Guide. Learn all about Amazon Web Services Tools, Services, and Certifications.",https://github.com/mikeroyal/AWS-Guide,50,248,12,36,2021-04-11,2023-03-17
crane,migtools,"Tool for migrating Kubernetes workloads, and their data, between clusters.",https://github.com/migtools/crane,21,23,16,104,2021-04-26,2023-03-10
edge-api,RedHatInsights,An API server for fleet edge management capabilities,https://github.com/RedHatInsights/edge-api,35,17,18,5822,2021-04-12,2023-03-20
Azure-Guide,mikeroyal,"Microsoft Azure Guide. Learn all about Microsoft Azure Tools, Services, and Certifications.",https://github.com/mikeroyal/Azure-Guide,17,138,11,27,2021-04-11,2023-01-14
sak-incubator,provectus,Incubator for SAK project modules,https://github.com/provectus/sak-incubator,6,8,86,69,2021-04-19,2023-02-23
cloud-native-postgresql-helm,EnterpriseDB,Helm charts to deploy Cloud Native PostgreSQL,https://github.com/EnterpriseDB/cloud-native-postgresql-helm,3,8,15,41,2021-04-27,2023-03-07
newrelic-infra-operator,newrelic,This repository hosts the newrelic kubernetes operator of infrastructure,https://github.com/newrelic/newrelic-infra-operator,4,1,11,134,2021-04-27,2023-03-20
OpenSLO,OpenSLO,Open specification for defining and expressing service level objectives (SLO),https://github.com/OpenSLO/OpenSLO,46,1133,36,288,2021-04-27,2023-03-15
terraform-spotinst-ocean-aks,spotinst,A Terraform module to create an Azure Kubernetes Service (AKS) cluster with Ocean.,https://github.com/spotinst/terraform-spotinst-ocean-aks,3,0,10,16,2021-04-19,2022-09-12
mysql-operator,mysql,MySQL Operator for Kubernetes,https://github.com/mysql/mysql-operator,83,514,40,602,2021-05-26,2023-02-08
terraform-on-aws-ec2,stacksimplify,"Terraform On AWS for EC2, VPC, ASG, ALB, CLB, NLB, CloudWatch, SNS, S3, CodePipeline, ACM, Route53",https://github.com/stacksimplify/terraform-on-aws-ec2,2143,331,27,7,2021-05-14,2023-01-12
elcarro-oracle-operator,GoogleCloudPlatform,"El Carro is a new project that offers a way to run Oracle databases in Kubernetes as a portable, open source, community driven, no vendor lock-in container orchestration system. El Carro provides a powerful declarative API for comprehensive and consistent configuration and deployment as well as for real-time operations and monitoring.",https://github.com/GoogleCloudPlatform/elcarro-oracle-operator,56,209,23,320,2021-05-13,2023-03-20
k8ssandra-operator,k8ssandra,The Kubernetes operator for K8ssandra,https://github.com/k8ssandra/k8ssandra-operator,45,75,12,464,2021-06-11,2023-03-21
awx-on-k3s,kurokobo,"An example implementation of AWX on single node K3s using AWX Operator, with easy-to-use simplified configuration with ownership of data and passwords.",https://github.com/kurokobo/awx-on-k3s,86,256,16,210,2021-05-30,2023-03-20
Kubernetes-Starter-Kit-Developers,digitalocean,Hands-on tutorial and Automation stack for an operations-ready DigitalOcean Kubernetes (DOKS) cluster.,https://github.com/digitalocean/Kubernetes-Starter-Kit-Developers,201,527,27,516,2021-06-21,2022-12-22
testkube,kubeshop,☸️ Kubernetes-native testing framework for test execution and orchestration,https://github.com/kubeshop/testkube,70,714,17,1852,2021-07-01,2023-03-20
naml,krisnova,Convert Kubernetes YAML to Golang,https://github.com/krisnova/naml,34,1205,20,253,2021-06-12,2022-07-20
kubeprober,erda-project,Large-scale Kubernetes cluster diagnostic tool.,https://github.com/erda-project/kubeprober,29,113,15,302,2021-06-09,2022-08-29
