Name,Owner,Desc,url,forks,stars,commits,watches,created_at,pushed_at
azurestorageexplorer,sebagomez,"☁💾 Manage your Azure Storage blobs, tables, queues and file shares from this simple and intuitive web application.",https://github.com/sebagomez/azurestorageexplorer,63,112,15,425,2014-02-09,2023-03-09
tyk,TykTechnologies,"Tyk Open Source API Gateway written in Go, supporting REST, GraphQL, TCP and gRPC protocols",https://github.com/TykTechnologies/tyk,989,8221,276,4209,2014-05-07,2023-03-20
docker-minecraft-server,itzg,Docker image that provides a Minecraft Server that will automatically download selected version at startup,https://github.com/itzg/docker-minecraft-server,1227,6349,61,1711,2014-05-17,2023-03-20
ToolsOfTheTrade,cjbarber,"Tools of The Trade, from Hacker News.",https://github.com/cjbarber/ToolsOfTheTrade,1267,15913,485,648,2014-05-29,2023-03-14
juju,juju,"Universal Operator Lifecycle Manager (OLM) for Kubernetes operators, and operators for traditional Linux apps, with declarative integration between operators for automated microservice integration.",https://github.com/juju/juju,456,2102,79,78737,2014-06-03,2023-03-21
awesome-elixir,h4cc,"A curated list of amazingly awesome Elixir and Erlang libraries, resources and shiny things. Updates:",https://github.com/h4cc/awesome-elixir,1126,11789,375,2074,2014-07-01,2023-03-02
spinnaker,spinnaker,"Spinnaker is an open source, multi-cloud continuous delivery platform for releasing software changes with high velocity and confidence.",https://github.com/spinnaker/spinnaker,1191,8841,344,2087,2014-07-02,2023-01-26
seaweedfs,seaweedfs,"SeaweedFS is a fast distributed storage system for blobs, objects, files, and data lake, for billions of files! Blob store has O(1) disk seek, cloud tiering. Filer supports Cloud Drive, cross-DC active-active replication, Kubernetes, POSIX FUSE mount, S3 API, S3 Gateway, Hadoop, WebDAV, encryption, Erasure Coding.",https://github.com/seaweedfs/seaweedfs,1937,16855,520,9294,2014-07-14,2023-03-20
awesome-swift,matteocrippa,A collaborative list of awesome Swift libraries and resources. Feel free to contribute!,https://github.com/matteocrippa/awesome-swift,3035,23081,914,3909,2014-07-10,2023-03-15
awesome-dotnet,quozd,"A collection of awesome .NET libraries, tools, frameworks and software",https://github.com/quozd/awesome-dotnet,2492,16349,1110,1577,2014-07-16,2023-03-14
awesome-rust,rust-unofficial,A curated list of Rust code and resources.,https://github.com/rust-unofficial/awesome-rust,2117,33307,782,3886,2014-07-17,2023-03-18
awesome-pentest,enaqx,"A collection of awesome penetration testing resources, tools and other shiny things",https://github.com/enaqx/awesome-pentest,4171,18081,1152,824,2014-08-03,2023-01-07
noobaa-core,noobaa,"NooBaa is a Dynamic Data Gateway for cloud-native, hybrid and multi cloud environments :cloud::rocket:",https://github.com/noobaa/noobaa-core,68,226,17,11794,2014-09-11,2023-03-20
awesome-zsh-plugins,unixorn,"A collection of ZSH frameworks, plugins, themes and tutorials.",https://github.com/unixorn/awesome-zsh-plugins,497,12559,176,4849,2014-10-07,2023-03-19
ci.docker,WASdev,Build scripts for Docker images (Dockerfiles) and Docker related utilities for WebSphere Liberty.,https://github.com/WASdev/ci.docker,120,121,29,930,2014-11-25,2023-03-13
ari,CyCoreSystems,Golang Asterisk REST Interface (ARI) library,https://github.com/CyCoreSystems/ari,58,147,20,672,2014-11-30,2023-03-08
minio,minio,Multi-Cloud :cloud: Object Storage,https://github.com/minio/minio,4545,38076,610,10472,2015-01-14,2023-03-21
airflow,apache,"Apache Airflow - A platform to programmatically author, schedule, and monitor workflows",https://github.com/apache/airflow,12084,29529,757,19199,2015-04-13,2023-03-21
spilo,zalando,Highly available elephant herd: HA PostgreSQL cluster using Docker,https://github.com/zalando/spilo,295,1120,48,799,2015-04-17,2023-03-16
prometheus-boshrelease,bosh-prometheus,Prometheus BOSH Release,https://github.com/bosh-prometheus/prometheus-boshrelease,158,113,44,1762,2015-04-21,2023-03-13
open-event-server,fossasia,The Open Event Organizer Server to Manage Events https://test-api.eventyay.com,https://github.com/fossasia/open-event-server,1869,2882,48,8438,2015-05-08,2023-03-20
kubernetes-client,fabric8io,Java client for Kubernetes & OpenShift,https://github.com/fabric8io/kubernetes-client,1335,2899,128,5556,2015-07-09,2023-03-20
awesome-go,uhub,"A curated list of awesome Go frameworks, libraries and software.",https://github.com/uhub/awesome-go,149,1237,57,142,2015-08-12,2023-03-05
go-workshops,exu,Go language basic workshops for devz,https://github.com/exu/go-workshops,16,70,10,348,2015-08-06,2023-02-25
awesome-cpp,uhub,"A curated list of awesome C++ frameworks, libraries and software.",https://github.com/uhub/awesome-cpp,180,900,78,105,2015-08-12,2023-03-01
awesome-python,uhub,"A curated list of awesome Python frameworks, libraries and software.",https://github.com/uhub/awesome-python,174,839,52,101,2015-08-12,2023-03-14
awesome-perl,uhub,"A curated list of awesome Perl frameworks, libraries and software.",https://github.com/uhub/awesome-perl,21,78,13,100,2015-08-12,2023-03-12
awesome-erlang,uhub,"A curated list of awesome Erlang frameworks, libraries and software.",https://github.com/uhub/awesome-erlang,42,298,26,97,2015-08-13,2023-03-04
awesome-scala,uhub,"A curated list of awesome Scala frameworks, libraries and software.",https://github.com/uhub/awesome-scala,37,192,22,104,2015-08-12,2023-03-17
awesome-lua,uhub,"A curated list of awesome Lua frameworks, libraries and software.",https://github.com/uhub/awesome-lua,49,455,33,101,2015-08-12,2023-03-09
garden-runc-release,cloudfoundry,,https://github.com/cloudfoundry/garden-runc-release,72,62,51,2974,2015-09-07,2023-03-20
coco-mongodb,Financial-Times,,https://github.com/Financial-Times/coco-mongodb,2,0,22,101,2015-09-21,2023-03-17
awesome-tor,ajvb,"A list of awesome Tor related projects, articles, papers, etc",https://github.com/ajvb/awesome-tor,60,328,21,62,2015-11-19,2023-01-17
awesome-elasticsearch,dzharii,"A curated list of the most important and useful resources about elasticsearch: articles, videos, blogs, tips and tricks, use cases. All about Elasticsearch!",https://github.com/dzharii/awesome-elasticsearch,559,4544,226,185,2015-11-09,2022-09-20
professional-programming,charlax,A collection of learning resources for curious software engineers,https://github.com/charlax/professional-programming,1997,23095,642,348,2015-11-07,2023-03-12
artwork,cncf,🎨 CNCF-related logos and artwork,https://github.com/cncf/artwork,257,419,31,575,2015-12-07,2023-03-15
static-analysis,analysis-tools-dev,"⚙️ A curated list of static analysis (SAST) tools and linters for all programming languages, config files, build tools, and more. The focus is on tools which improve code quality.",https://github.com/analysis-tools-dev/static-analysis,1238,11059,323,8346,2015-12-18,2023-03-20
fineract,apache,Apache Fineract,https://github.com/apache/fineract,1188,887,110,7224,2015-12-22,2023-03-21
scylla-cluster-tests,scylladb,Tests for Scylla Clusters,https://github.com/scylladb/scylla-cluster-tests,61,44,24,6768,2015-12-29,2023-03-20
elektra,sapcc,An opinionated openstack Web UI for consumer self service and operations.,https://github.com/sapcc/elektra,27,64,37,7213,2015-12-16,2023-03-17
nomulus,google,Top-level domain name registry service on Google App Engine,https://github.com/google/nomulus,275,1604,65,4318,2016-02-29,2023-03-20
spring-cloud-vault,spring-cloud,Configuration Integration with HashiCorp Vault,https://github.com/spring-cloud/spring-cloud-vault,138,260,34,636,2016-02-11,2023-03-04
jaeger,jaegertracing,"CNCF Jaeger, a Distributed Tracing Platform",https://github.com/jaegertracing/jaeger,2086,17341,339,1976,2016-04-15,2023-03-20
kubeturbo,turbonomic,,https://github.com/turbonomic/kubeturbo,64,117,29,1454,2016-04-19,2023-03-17
strimzi-kafka-bridge,strimzi,An HTTP bridge for Apache Kafka®,https://github.com/strimzi/strimzi-kafka-bridge,101,222,22,728,2016-03-21,2023-03-20
awesome-kafka,infoslack,A list about Apache Kafka,https://github.com/infoslack/awesome-kafka,151,526,29,70,2016-04-29,2022-11-30
changelog,halon,Halon MTA changelog,https://github.com/halon/changelog,0,8,19,393,2016-04-01,2023-02-20
strimzi-kafka-operator,strimzi,Apache Kafka® running on Kubernetes,https://github.com/strimzi/strimzi-kafka-operator,1075,3721,95,5131,2016-05-06,2023-03-21
kube2iam,jtblin,kube2iam  provides different AWS IAM roles for pods running on Kubernetes,https://github.com/jtblin/kube2iam,311,1895,46,207,2016-05-08,2023-02-06
kube-state-metrics,kubernetes,Add-on agent to generate and expose cluster-level metrics.,https://github.com/kubernetes/kube-state-metrics,1659,4401,80,2587,2016-05-06,2023-03-17
node-problem-detector,kubernetes,This is a place for various problem detectors running on the Kubernetes nodes.,https://github.com/kubernetes/node-problem-detector,530,2268,55,753,2016-05-17,2023-02-23
awesome-terraform,shuaibiyy,Curated list of resources on HashiCorp's Terraform,https://github.com/shuaibiyy/awesome-terraform,681,4161,175,446,2016-05-10,2023-03-10
All-About-Programming,EQuimper,Everything about programming!!,https://github.com/EQuimper/All-About-Programming,107,339,35,264,2016-05-29,2022-09-13
awesome-csirt,Spacial,Awesome CSIRT is an curated list of links and resources in security and CSIRT daily activities.,https://github.com/Spacial/awesome-csirt,74,311,31,387,2016-05-23,2023-02-03
coherence-demo,coherence-community,The Coherence Demonstration,https://github.com/coherence-community/coherence-demo,10,14,14,113,2016-06-07,2023-03-03
rook,rook,Storage Orchestration for Kubernetes,https://github.com/rook/rook,2503,10843,266,9699,2016-07-08,2023-03-20
openebs,openebs,"Leading Open Source Container Attached Storage, built using Cloud Native Architecture, simplifies running Stateful Applications on Kubernetes.",https://github.com/openebs/openebs,951,8030,157,2911,2016-08-01,2023-03-15
DevOps,yangpeng14,自动化运维指南 https://www.yp14.cn,https://github.com/yangpeng14/DevOps,170,326,15,679,2016-07-18,2022-10-30
manageiq-pods,ManageIQ,ManageIQ on Kubernetes and OpenShift,https://github.com/ManageIQ/manageiq-pods,98,48,12,1687,2016-07-13,2023-03-20
awesome-stars,maguowei,My Awesome List,https://github.com/maguowei/awesome-stars,61,328,15,1632,2016-07-24,2023-03-21
awesome-keycloak,thomasdarimont,A curated list of resources for learning about http://www.keycloak.org,https://github.com/thomasdarimont/awesome-keycloak,168,1359,79,253,2016-07-11,2023-03-20
selinon,selinon,An advanced distributed task flow management on top of Celery,https://github.com/selinon/selinon,30,283,24,607,2016-07-29,2023-01-27
programming-guidelines,guettli,My personal programming guidelines,https://github.com/guettli/programming-guidelines,41,264,21,661,2016-07-28,2022-12-15
LightGBM,microsoft,"A fast, distributed, high performance gradient boosting (GBT, GBDT, GBRT, GBM or MART) framework based on decision tree algorithms, used for ranking, classification and many other machine learning tasks.",https://github.com/microsoft/LightGBM,3695,14764,443,3227,2016-08-05,2023-03-19
cluster-proportional-autoscaler,kubernetes-sigs,Kubernetes Cluster Proportional Autoscaler Container,https://github.com/kubernetes-sigs/cluster-proportional-autoscaler,112,467,21,142,2016-08-02,2023-03-03
prometheus-operator,prometheus-operator,Prometheus Operator creates/configures/manages Prometheus clusters atop Kubernetes,https://github.com/prometheus-operator/prometheus-operator,3490,7859,151,5555,2016-09-22,2023-03-20
kubernetes-kafka,Yolean,"Kafka cluster as Kubernetes StatefulSet, plain manifests and config",https://github.com/Yolean/kubernetes-kafka,743,1782,60,805,2016-09-05,2023-02-17
kubernetic,harbur,Kubernetic - Supercharge your Kubernetes clusters,https://github.com/harbur/kubernetic,25,264,13,223,2016-09-14,2022-08-30
service-fabrik-broker,cloudfoundry,Cloud Foundry service broker which provisions service instances as Docker containers and BOSH deployments.,https://github.com/cloudfoundry/service-fabrik-broker,48,40,19,2474,2016-09-20,2023-03-14
cluster-capacity,kubernetes-sigs,Cluster capacity analysis,https://github.com/kubernetes-sigs/cluster-capacity,95,356,25,483,2016-09-26,2023-01-30
galaxy-helm,galaxyproject,Minimal setup required to run Galaxy under Kubernetes,https://github.com/galaxyproject/galaxy-helm,33,27,14,810,2016-09-29,2023-03-17
osb-elasticsearch,evoila,Open Service Broker providing Elasticsearch Service Instances. Compatible with Cloud Foundry and Kubernetes Open Service Broker API implementations.,https://github.com/evoila/osb-elasticsearch,4,4,11,241,2016-09-12,2022-10-20
kube-prometheus,prometheus-operator,Use Prometheus to monitor Kubernetes and applications running on Kubernetes,https://github.com/prometheus-operator/kube-prometheus,1638,5108,56,2829,2016-10-24,2023-03-20
maya,openebs,Manage Container Attached Storage (CAS) - Data Engines in Kubernetes,https://github.com/openebs/maya,201,180,23,1799,2016-10-06,2023-03-07
ansible-vault,ansible-community,:key: Ansible role for Hashicorp Vault,https://github.com/ansible-community/ansible-vault,181,302,12,607,2016-10-14,2023-03-17
every-single-day-i-tldr,sderosiaux,"A daily digest of the articles or videos I've found interesting, that I want to share with you.",https://github.com/sderosiaux/every-single-day-i-tldr,20,299,47,2970,2016-10-07,2023-03-12
scimgateway,jelhub,Using SCIM protocol as a gateway for user provisioning to other endpoints,https://github.com/jelhub/scimgateway,46,119,11,491,2016-10-22,2023-03-06
swift-drive-autopilot,sapcc,Finds and mounts Swift storage drives (also from within a container),https://github.com/sapcc/swift-drive-autopilot,0,8,43,360,2016-10-13,2023-03-17
rocketmq,apache,"Apache RocketMQ is a cloud native messaging and streaming platform, making it simple to build event-driven applications.",https://github.com/apache/rocketmq,10668,18916,896,7995,2016-11-30,2023-03-21
istio,istio,"Connect, secure, control, and observe services.",https://github.com/istio/istio,7042,32626,1021,19929,2016-11-18,2023-03-21
cloud-dataproc,GoogleCloudDataproc,Cloud Dataproc: Samples and Utils,https://github.com/GoogleCloudDataproc/cloud-dataproc,120,178,36,180,2016-11-02,2022-12-20
kubernetes-operators,sapcc,Operators that automate common tasks for managing Openstack on Kubernetes.,https://github.com/sapcc/kubernetes-operators,14,122,43,373,2016-11-18,2023-03-20
kvm-operator,giantswarm,Handles Kubernetes clusters running on a Kubernetes cluster with workers and masters in KVMs on bare metal,https://github.com/giantswarm/kvm-operator,13,88,19,1057,2016-11-17,2023-03-16
kube-slack,wongnai,Kubernetes Slack Monitoring,https://github.com/wongnai/kube-slack,62,323,13,120,2016-11-15,2022-11-29
jiva,openebs,CAS Data Engine - iSCSI Distributed Block Storage Controller built-in Go,https://github.com/openebs/jiva,65,133,19,804,2016-11-11,2023-02-25
docker-compose-wait,ufoscout,A simple script to wait for other docker images to be started while using docker-compose,https://github.com/ufoscout/docker-compose-wait,136,1438,16,107,2016-11-30,2022-10-20
awesome-hacking,jekil,Awesome hacking is an awesome collection of hacking tools.,https://github.com/jekil/awesome-hacking,518,2312,137,511,2016-11-03,2023-03-16
nats-operator,nats-io,NATS Operator,https://github.com/nats-io/nats-operator,110,556,15,588,2016-12-04,2022-08-30
searchlight,searchlight,🔦 Alerts for Kubernetes,https://github.com/searchlight/searchlight,23,316,16,576,2016-12-21,2023-03-04
CPU-Manager-for-Kubernetes,intel,Kubernetes Core Manager for NFV workloads,https://github.com/intel/CPU-Manager-for-Kubernetes,86,186,27,390,2016-12-20,2023-01-18
aws-operator,giantswarm,Manages Kubernetes clusters running on AWS (before Cluster API),https://github.com/giantswarm/aws-operator,22,129,18,2717,2017-02-01,2023-03-20
awesome-prometheus,roaldnefs,"A curated list of awesome Prometheus resources, projects and tools.",https://github.com/roaldnefs/awesome-prometheus,151,1321,52,112,2017-01-09,2023-03-12
kube-lint,viglesiasce,A linter for Kubernetes resources with a customizable rule set,https://github.com/viglesiasce/kube-lint,12,156,11,36,2017-01-19,2023-02-25
logr,go-logr,A simple logging interface for Go,https://github.com/go-logr/logr,70,939,18,240,2017-01-17,2022-12-08
favor_repos,lrita,,https://github.com/lrita/favor_repos,28,51,11,39,2017-01-16,2022-07-13
postgres-operator,CrunchyData,"Production PostgreSQL for Kubernetes, from high availability Postgres clusters to full-scale database-as-a-service.",https://github.com/CrunchyData/postgres-operator,500,3208,61,3708,2017-02-27,2023-03-20
mentoring,cncf,👩🏿‍🎓👨🏽‍🎓👩🏻‍🎓CNCF Mentoring + CommunityBridge + Summer of Code,https://github.com/cncf/mentoring,486,1593,133,1409,2017-02-08,2023-03-20
stash,stashed,🛅 Backup your Kubernetes Stateful Applications,https://github.com/stashed/stash,87,1174,23,1233,2017-02-28,2023-03-18
performance_testing,mgasiorowski,"Tools, articles, etc. related to performance/load/etc. testing.",https://github.com/mgasiorowski/performance_testing,25,173,15,48,2017-02-14,2022-08-19
APT_CyberCriminal_Campagin_Collections,CyberMonitor,APT & CyberCriminal Campaign Collection,https://github.com/CyberMonitor/APT_CyberCriminal_Campagin_Collections,844,3107,438,1176,2017-02-11,2023-03-16
rocketmq-externals,apache,Mirror of Apache RocketMQ (Incubating),https://github.com/apache/rocketmq-externals,3053,4379,272,982,2017-03-14,2022-12-08
litmus,litmuschaos,Litmus helps  SREs and developers practice chaos engineering in a Cloud-native way. Chaos experiments are published at the ChaosHub  (https://hub.litmuschaos.io). Community notes is at https://hackmd.io/a4Zu_sH4TZGeih-xCimi3Q,https://github.com/litmuschaos/litmus,556,3557,66,2523,2017-03-15,2023-03-20
mattermost-helm,mattermost,Mattermost Helm charts for Kubernetes,https://github.com/mattermost/mattermost-helm,134,152,41,314,2017-03-23,2023-03-16
cert-operator,giantswarm,cert-operator creates and manages certificates for Kubernetes clusters running on Giant Swarm,https://github.com/giantswarm/cert-operator,7,37,14,439,2017-03-13,2023-03-17
lbex,sostheim,External Load Balancer for GKE Based Kubernetes Services,https://github.com/sostheim/lbex,5,7,17,190,2017-03-13,2022-08-24
examples,k8spatterns,"Examples for ""Kubernetes Patterns - Reusable Elements for Designing Cloud-Native Applications"" ",https://github.com/k8spatterns/examples,231,874,51,218,2017-04-20,2023-03-19
operatorkit,giantswarm,An opinionated Go framework for developing Kubernetes operators,https://github.com/giantswarm/operatorkit,16,198,21,478,2017-04-10,2023-03-15
guide,hobby-kube,Kubernetes clusters for the hobbyist.,https://github.com/hobby-kube/guide,258,5361,114,68,2017-04-18,2023-01-24
kubernetes-secret-generator,mittwald,Kubernetes controller for automatically generating and updating secrets,https://github.com/mittwald/kubernetes-secret-generator,39,223,13,120,2017-04-11,2023-02-28
PaddleCloud,PaddlePaddle,PaddlePaddle Docker images and K8s operators for PaddleOCR/Detection developers to use on public/private cloud.,https://github.com/PaddlePaddle/PaddleCloud,71,242,28,425,2017-04-26,2022-07-26
enterprise_gateway,jupyter-server,"A lightweight, multi-tenant, scalable and secure gateway that enables Jupyter Notebooks to share resources across distributed clusters such as Apache Spark, Kubernetes and others.",https://github.com/jupyter-server/enterprise_gateway,203,550,42,1322,2017-04-21,2023-03-21
blog_demos,zq2599,CSDN博客专家程序员欣宸的github，这里有六百多篇原创文章的详细分类和汇总，以及对应的源码，内容涉及Java、Docker、Kubernetes、DevOPS等方面,https://github.com/zq2599/blog_demos,1570,3473,106,902,2017-04-09,2023-03-15
kubernikus,sapcc,Kubernetes as a Service for Openstack,https://github.com/sapcc/kubernikus,28,129,42,2182,2017-04-24,2023-03-17
docker-tools,instantlinux,Docker tools for developer productivity & entertainment,https://github.com/instantlinux/docker-tools,81,228,11,517,2017-04-03,2023-02-24
kubeadm-playbook,ReSearchITEng,"Fully fledged (HA) Kubernetes Cluster using official kubeadm, ansible and helm. Tested on RHEL/CentOS/Ubuntu with support of http_proxy, dashboard installed, ingress controller, heapster - using official helm charts",https://github.com/ReSearchITEng/kubeadm-playbook,101,583,21,492,2017-04-12,2022-12-28
kubecrt,blendle,Convert Helm charts to Kubernetes resources.,https://github.com/blendle/kubecrt,12,114,15,57,2017-04-23,2023-03-07
microprofile-health,eclipse,microprofile-health,https://github.com/eclipse/microprofile-health,58,94,28,406,2017-04-25,2022-10-04
hermes,sapcc,Audit Data API for OpenStack deployments.,https://github.com/sapcc/hermes,3,13,35,376,2017-04-27,2023-03-16
dockerfile-varnish,livingdocsIO,"A varnish setup with config hot reloading, ready to use in kubernetes and dockerized environments.",https://github.com/livingdocsIO/dockerfile-varnish,2,4,27,186,2017-04-24,2022-11-11
postgres-operator,zalando,Postgres operator creates and manages PostgreSQL clusters running in Kubernetes,https://github.com/zalando/postgres-operator,851,3180,61,1241,2017-05-12,2023-03-20
awesome-cloud-security,Funkmyster,"Curated list of awesome cloud security blogs, podcasts, standards, projects, and examples.",https://github.com/Funkmyster/awesome-cloud-security,83,413,12,41,2017-05-28,2023-01-25
nuclio,nuclio,High-Performance Serverless event and data processing platform,https://github.com/nuclio/nuclio,486,4785,116,2312,2017-05-19,2023-03-20
prometheus-adapter,kubernetes-sigs,An implementation of the custom.metrics.k8s.io API using Prometheus,https://github.com/kubernetes-sigs/prometheus-adapter,495,1605,30,432,2017-05-10,2023-03-16
sealed-secrets,bitnami-labs,A Kubernetes controller and tool for one-way encrypted Secrets,https://github.com/bitnami-labs/sealed-secrets,565,5991,66,1097,2017-05-29,2023-03-20
neonKUBE,nforgeio,Public neonKUBE projects,https://github.com/nforgeio/neonKUBE,14,66,11,11045,2017-05-29,2023-03-21
awesome-jordan,jordanopensource,Awesome open source projects in Jordan,https://github.com/jordanopensource/awesome-jordan,31,56,19,108,2017-05-23,2022-11-22
retagger,giantswarm,A tool to handle the retagging of third party docker images,https://github.com/giantswarm/retagger,5,23,14,895,2017-05-12,2023-03-20
maia,sapcc,Prometheus dressed as OpenStack service,https://github.com/sapcc/maia,3,12,40,224,2017-05-21,2023-03-16
bookmarks,MorganGeek,:bookmark: +5K awesome resources for geeks and software crafters :beer:,https://github.com/MorganGeek/bookmarks,71,380,20,3833,2017-05-26,2023-02-20
training-operator,kubeflow,Training operators on Kubernetes.,https://github.com/kubeflow/training-operator,529,1231,81,860,2017-06-28,2023-03-19
keel,keel-hq,"Kubernetes Operator to automate Helm, DaemonSet, StatefulSet & Deployment updates",https://github.com/keel-hq/keel,265,2162,33,1397,2017-06-10,2023-03-07
kubicorn,kubicorn,"Simple, cloud native infrastructure for Kubernetes. ",https://github.com/kubicorn/kubicorn,200,1683,54,1395,2017-06-10,2022-10-05
metering-operator,kube-reporting,"The Metering Operator is responsible for collecting metrics and other information about what's happening in a Kubernetes cluster, and providing a way to create reports on the collected data. ",https://github.com/kube-reporting/metering-operator,90,334,15,3997,2017-06-05,2023-03-14
faas-netes,openfaas,Serverless Functions For Kubernetes,https://github.com/openfaas/faas-netes,465,2030,43,1359,2017-07-23,2023-03-20
awesome-cloud-native,rootsongjc,"A curated list for awesome cloud native tools, software and tutorials.  - https://jimmysong.io/awesome-cloud-native/",https://github.com/rootsongjc/awesome-cloud-native,312,1683,98,647,2017-07-15,2023-03-10
presentation-gitlab-k8s,galexrt,These are the example files for my presentation and blog post about GitLab + Kubernetes for Continuous Delivery.,https://github.com/galexrt/presentation-gitlab-k8s,131,162,10,120,2017-07-09,2023-03-08
descheduler,kubernetes-sigs,Descheduler for Kubernetes,https://github.com/kubernetes-sigs/descheduler,565,3231,49,1342,2017-07-28,2023-03-16
auger,jpbetz,Directly access data objects stored in etcd by kubernetes.,https://github.com/jpbetz/auger,51,308,11,66,2017-07-31,2023-02-25
fabric-test,hyperledger,A collection of utilities used to test the core Hyperledger Fabric projects,https://github.com/hyperledger/fabric-test,128,150,18,1272,2017-07-26,2023-02-28
terraform-aws-ec2-instance,cloudposse,Terraform module for provisioning a general purpose EC2 host,https://github.com/cloudposse/terraform-aws-ec2-instance,191,135,23,88,2017-08-01,2023-03-13
operator-lifecycle-manager,operator-framework,A management framework for extending Kubernetes with Operators,https://github.com/operator-framework/operator-lifecycle-manager,521,1460,50,4179,2017-08-11,2023-03-15
lagoon,uselagoon,"Lagoon, the developer-focused application delivery platform",https://github.com/uselagoon/lagoon,142,474,22,10707,2017-08-30,2023-03-21
MMdnn,microsoft,"MMdnn is a set of tools to help users inter-operate among different deep learning frameworks. E.g. model conversion and visualization. Convert models between Caffe, Keras, MXNet, Tensorflow, CNTK, PyTorch Onnx and CoreML.",https://github.com/microsoft/MMdnn,977,5694,186,1084,2017-08-16,2022-09-22
azure-operator,giantswarm,Manages Kubernetes clusters running in in a Giant Swarm installation on Microsoft Azure,https://github.com/giantswarm/azure-operator,7,32,18,1432,2017-08-02,2023-03-17
horovod,horovod,"Distributed training framework for TensorFlow, Keras, PyTorch, and Apache MXNet.",https://github.com/horovod/horovod,2163,13126,330,1300,2017-08-09,2023-03-20
decco,platform9,Deployment cluster configuration and operations for Kubernetes,https://github.com/platform9/decco,6,32,45,234,2017-08-22,2023-01-16
